,review
40,"Hollywood's ""foreign"" classifications should be immediately done away with. What does the designation tell us about this extraordinary movie to call it ""foreign""? Foreign to whom and in what way? Yep, I get it, not made in America (Hollywood) and not in English. That designation means nothing used for a movie of such universal themes so easily accessible to the viewer. The director has observed the Kurosawa principle about balancing all the elements of the film's language, in addition to keeping to his own approach of keeping the narrative and dramatic aspects simple. Even with subtitles I was laughing out loud at the humorous bits. Can western movies claim that when they're subtitled in other languages? This sublime simplicity results in a movie so finely calibrated that it wipes out in one fell swoop the tiresome arthouse talking head cinematic tradition of the west. The South Korean film isn't ""foreign"", it's smack in the middle of a filmmaking tradition that respects the story, the viewer and the very medium of film. Think Kurosawa, again. How sublime in their simplicity are his movies? Critics carry in about what genre it is? What political and sociological commentary the director is trying out. None of that matters when a movie is so tonally pitch perfect. The ""change"" of pace about half way through is so seamless, one gasps long after the last frame that it couldn't possibly have gone any other way. It's the power of the impeccable story telling via the medium of film that elevates this movie above the fray.
Editing, acting, cinematography are all pitch perfect. Hollywood, go cry in your pretzels, with your endless commercial blockbusters and franchises. The centre of gravity has shifted and you are now the ""foreigner"" while the South Korean holds court in the center of the global cinematic universe. Thank you for giving it the ""best"" picture award full stop. It is one of the greatest films of all time in its tone, seamlessness, simplicity, and both the humour and tragedy of the human story it depicts. A great, great, great cinematic experience. Ten stars barely begins to convey the greatness."
41,"Perfectly told story with perfectly logical plots and motives for every character, justification for every frame and accompanied by a thought-provoking message that lingers long after you leave the theatre. Surely one of the best of cinema."
42,I've never watched a movie like this one. It's a masterpiece.
43,"The best movie of 2019 has everything: great acting, fabulous screenplay, with funny, tense and plot-twist moments, excelent directing, social critics and acid jokes. A monumental (but easy-to-consume) piece of art that satisfies all audience's tastes. Highly recommended."
44,"Parasite is a masterpiece, an unpredictable film about class division that skillfully manages to easily combine different genres and create a truly unique and complex experience that's smart, funny and tense. All of the performances are incredible with Kang-ho Song, Woo-sik Choi and So-dam Park giving the standout performances. Bong Joon-ho's direction is incredible, it's beautifully filmed and the pacing is superb, constantly extremely engaging for the entirety of its run time. The music by Jung Jae-il is amazing."
45,I just finished this movie. This whole movie give an amazing experience. The story is beyond our imagination. The performance of the all cast is just outstanding. It's a must watch for all movie lovers.
46,"This movie is a masterpiece. It is well casted and acted, the cinematography was very well done. The themes are thought provoking. But the greatest thing about this movie is how much love, effort and dedication went into this. This movie has every genre in it, yet it doesn't feel too cramped. It might be unrealistic and some parts but the story was so amazing. The little details in this movie is what makes it a modern day masterpiece.Parasite is one of those movies that you will never forget and rewatch it over and over again. It is such a fine experience watching this movie, and everything is perfect about it. 10/10"
47,This movie is really great korean movie with great cast and just idea for this movie is unique and it is one of best foreign movies out there
48,"I came to see this hyped-out title and was expecting to see it flop, only to be amazed by its brilliance and cinematography. Simplicity without a doubt is the ultimate sophistication.I feel Parasite was an infastation to Western cinematography, taking all tip awards and leaving nothing behind. Eastern cinema has a lot more to offer than cheesy martial arts and special effects, and Parasite is the gateway towards this level of cinematic appreciation.
This movie portrays a lower-class family, making ends meet and struggling to survive in a capitally oriented world, by skipping into the higher layer of society. Although they have less to show, they are more of a family than their higher-class counterpart, living the life of riches without ever fully experiencing any of it together. In a way, it blends and clearly separates these two worlds, similair in essence but completely different in reality.It is a manifesto on class struggles and how social stratification represents an unpenetrable rock wall, where a lifetime is not enough to break free and move to a higher layer. Because of this, you are forced to become a parasite and take from others to grow, or remain a parasite of society and depend on the generousity of the Rich.In the end, one has to wonder if Capital is a true parasite of our lives, taking our focus from the importance of the human experience and manipulating our life's purpose as it pleases?"
49,"This movie, starting as a clever comedy turns into a deep drama in a modern context of social inequities. This movie undelines how social classes remain splitted in today's world (almost as spltited as in Gosford Park). It also questions how the poor working class have to struggle against itself to benefit from the little that can runoff from the rich ones.
Great actor playing and the right pace in the movie makes it a fantastic experience."
