,review
29,"It is sad that the world is not more accepting of those with mental or physical handicaps. Given a chance, we find that such beings are more than capable. Everyone can contribute to the world, no matter how big or small.If you're like many other people who've seen this beloved series, you'll find yourself immediately enamored by Attorney Woo Young Woo...no matter how it's flipped, it reads the same! And no matter how much you try to look at Woo in a different way, she's still her charming, cute, and beautiful self!We all need a Woo Young Woo in our lives. Such people are often devoid of egotistical traits. There is no animosity or hatred behind their words. And when they love, they love completely. How many people in the world can claim this? We often look at people in the world like Woo Young Woo as having problems. And yet, I daresay, perhaps WE are the ones who should be more like her! Such is the purity of innocence. To have the essence and wonderment of a child. And why are children so wonderful? Because they're like sponges who are free of shame and guilt-such traits are learned behaviors that are sadly instilled in them by parents, society, culture, religion, etc. Woo Young Woo is like being an eternal child, and that is not a bad thing! It's something we should all aspire to be.Like very few autistic people, Woo Young Woo would be classified as a savant. Someone with incredible mental abilities to remember pretty much anything and everything. Such a skill makes Woo Young Woo an amazing asset as an attorney, despite her lack of ability to read people and understand various emotions. Sudden emotional outbursts tend to frighten her, and she's not immediately comfortable in foreign environments. She also has an aversion to being physically touched. But don't let these things fool you since Woo Young Woo has more charm than most people can begin to dream about.Eun Bin Park gives a tremendous performance as Woo Young Woo. The only other characters I've seen that match hers were autistic performances in ""It's Okay to Not Be Okay,"" and ""Move To Heaven"" (two more incredible Korean dramas if you're looking for something!). Eun Bin Park will have you laughing, smiling, and occasionally tearing up with her delightful performance. She may well have given us one of the cutest characters I've ever seen. And yet, she also shows us the absolute brilliance of Woo Young Woo as an attorney. Yes, we're talking about someone along the lines of a Perry Mason. But what makes her truly remarkable is her integrity; her unwillingness to compromise her values in doing what is right. How many attorneys can claim that?! Not very many, I'd wager.And, of course, because of Woo Young Woo's innocence, she also brings with it a childlike naivety which makes her vulnerable to those who would try to take advantage or mistreat her. It can be a bit painful sometimes to watch those scenes, as all you want to do is be like Jun-Ho and do your utmost to protect her.Woo Young Woo describes herself once as a narwhal living among beluga whales. She knows she's a bit peculiar to most people, but she not only learns to adapt but to accept herself as she is. I would actually go even further and say she's like a gold nugget among lumps of coal. She's far more precious and special than even she can comprehend or realize. And part of the charm of the show is watching those who doubted and even abused her, begin to soften and realize how precious she really is.Another beautiful aspect of the show is the simple, and yet beautiful romance between Woo Young Woo and Jun-Ho. And the reason why it is so incredibly unique is because Jun-Ho fully accepts Woo Young Woo as she is. He never asks her to change or be anything other than who she is. In short, this is one of the rare depictions of unconditional love that many people search for, and yet very seldom find.Extraordinary Attorney Woo is a true delight. It's also light drama in case you're searching for something that isn't too heavy. And the court cases are always very intriguing to watch as we wait and see what magic Woo Young Woo is about to pull. I've already heard that a second Season will be made. And well, I never get tired of Woo Young Woo's love and talk of whales. I definitely want another season of this charming and delightful show!"
30,"I don't watch Korean dramas. I don't watch much of anything anymore. I started this up because of the ""autistic lawyer"" twist thinking it sounded like a clever premise and because I have known autistic people. Wow, I'm hooked.I'm not good at reviews. I never do them. But just give it a chance and you'll love it, I'm sure."
31,"I've watched shows and read articles on autism. I don't know anyone personally with autism and I'm no expert by any means, but how this show portrays ASD is real but respectful. I fell in love with the main character as soon as the 5-year old Woo Young Woo spoke for the first time. I don't watch much TV shows and I'm not big on K-drama, but Extraordinary Attorney Woo has me hooked. I only started watching this show two days ago and I'm already on episode 7, and yes I will be watching more episodes tonight. I love this show!!!"
32,"I have read the books, watched the shows and personally have met and worked with autistic people but I can not say she ""nailed"" the depiction of a person with Asperger's. I can say, howerver, that she nailed it for me and in my opinion it is perfect. She did a exceptionally good job of being a male in King's Affection but in this one she could not be more impressive. Perhaps, she is scripted on how to act but she does it perfect. The show is a relatively solid 8/10 with the same scripts, storyline and great actors but Park Eun-bin genius is what makes this amazing. Again, my opinion but Korean actors are just better overall but she is another level."
33,"I loved this show so much. I hope there is a Season 2 forthcoming. I highly recommend. The characters and storyline were great. The actors were superb. The main character conveyed her role well, and there is something to be learned from it. It was easy to watch, with a bit of real life drama mixed in. I loved that it was based in Korea. It was different and entertaining, and I could not stop watching! I also appreciated the way her character had real life scenarios to move through. All of the characters were great though, and had struggles of their own. I may have to watch again! Please more shows of this caliber!"
34,"Firstly, the story is the predictable idiot savant story. So forget the destination, because the journey to get there is sheer delight.The viewer is taken into the customs of Korea, into realistic problems of aging couples, the justice system, being on a new job, and the autistic person who seems to be oblivious to menace, but then at times will just shut down, holding her head in her arms, unable to cope.The acting is first rate, I can't say the dialog is wonderful because I don't speak Korean, but the subtitles are spot-on.The autism isn't so much a focus as a dramatic tool in telling a story. WYW understands that she is an adult, but she relates to her father as a child, and has a child-like fascination with whales. Her character is essentially Pinocchio... or maybe a humanoid robot like Arisa.Dramatically, WYW presents as an almost comical robot, though highly intelligent and watchable. The comedy, aside from one extended ""gurgling stomach"" scene, is smart. The characters are human, sensitive, and honorable, which makes for pleasant watching.The artistry of this series is also stunning. My goodness, it felt like Heaven seeing WYW in a wedding dress."
35,"Eun-bin Park...outstanding actor and her portrayal Attorney Woo is OSCAR worthy. I don't know if Korea has an equivalent but she deserves the award. I try to quickly read the subtitles, catch the actor's facial expression and keep up with the story line. THE BEST Korean series I've seen in a long while. Not to be missed."
36,I enjoyed it so much great acting by the main characters. A part from episode 2 its realy great to extent it left me sad in the last episode that i wont watch that series again.
37,"Brilliant acting by young woo , brilliantly cast and storyline10/10.This show makes you happy and we keep waiting for the next episodeI have watched all the seasonNow waiting for 2nd seasonAbsolutely brilliant."
38,"I absolutely love this story. The episodes are insightful, warm and funny. Autism is presented so honestly and real. The main actress is incredible. I love the character development of those around her.The other women are presented as intelligent and educated and accepted for their credentials."
39,Fascinating to watch the thought process. Well written and beautifully scored. Woo Young Woo is engaging and lawyers in the firm are at once in awe and frustrated.
40,"I walked in to this series completely blind: And . . . It's awesome. It's a very well produced show in general and shines far beyond its fellow K-drama genre.Especially the lead actress, Ms. Park Eun-Bin, demonstrates an incredibly masterful level of acting as an absolutely adorable protagonist that suffers from the spectrum. I simply can't take my eyes off of her every move in this show.What amazes me is the attention to detail to certain vehicles for storytelling (e.g. The protagonist's obsession about whales). Out of all possible subjects for obsessions, it's definitely a really weird one.Without any spoilers, the whole whale thing could easily serve as a mere whimsical scene cutter just to bring out laughs.But as any viewer who've seen this show might have thought once or twice: ""BUT ... seriously, WHY whales?"" Later in the show, we get that answer; and upon discovery, I personally gasped: ""oh wow! THAT's why :) NICE.""It's very difficult to find something ""engaging"" to watch lately.But this show does a spectacular job in doing so. I will even dare say ... should I say it? Ahh why not : I think it's way better than Squid Game. So much better."
41,"I was a bit skeptical to watch this show when I read the actress wasn't autistic, but she and the entire show portray ASD realistically and thoughtfully. I cannot tell you how much I have enjoyed this show. Its premise is unique among all TV shows, not just Korean. And the best K drama I have watched in a while (maybe forever?) because of how the characters and script are written. The actors are all phenomenal and only elevate this show's premise and bring it to life even more. Not to mention, the show is hilarious and I have found myself laughing aloud and relaying scenes because they're actually gold. Do yourself a favor and watch this show already! I'm always bracing myself for the overdone, cliche themes you see in K dramas, but this show was the biggest breath of fresh air. Hoping for many, many episodes and seasons to come!"
42,"I had no clue what I was expecting, when I clicked on the show. From the first few minutes I was slowly drawn into the show, and by the end of the first episode, I was hooked. What an absolutely beautiful show."
43,"I just watched the final episode... wow... this show did everything right!! If you're looking for a feel good K-drama with romance/comedy/excitement then this is your show!! I loved everything about Woo Young Woo, what an amazing job done by Park Eun-Bin.I really feel like she grew a lot from the moment she started working at Hanbada.Park Eun-Bin deserves every award this season! I can't imagine having to memorize all the stuff about whales AND the law! HahaAnd Kang Tae-Oh... his character: DREAMY!!! I just couldn't stop swooning, the writers did a really great job!I just really loved the whole cast!! All the cases were interesting too. I'm thrilled about a season 2, can't wait!! I hope that we can see more of Young Woo & Junho... I would like to see them meet her father together. I really missed an introduction this season.I hated Kwon Min-woo in the first 12 episodes... but I really liked the way he grew as a person by the end of the season. All thanks to the lovely Choi Su-Yeon.Please watch this show, you will not regret it!"
44,"Totally captivated by this wonderful show! The lead, Park Eun-bin, is pitch-perfect. You will fall in love with the entire cast as every single actor is worthy of their own stories. I've never had the opportunity to visit South Korea, although I did live in Okinawa for several years. I am enjoying this look into South Korean life with it's marvelous scenery. I'm hoping whoever is responsible for this show is writing more episodes right now!!!"
45,"The actors in this series are just amazing. The chemistry, the bonds that are built as the series progress, the internal struggles some face, and so much more, is just amazing! It is so interesting how the writers/producers blend autism, romance, Korean culture, the law, and so much other day-to-day we all experience together in such a beautiful series.Park Eun Bin (that plays attorney Woo Young Woo) is superb in this role. Every episode leaves you with such a good feeling (caring/uplifting), and one just want to watch the next episode. Her supporting actors are also amazing in bringing the whole series together!If you going to watch this series, I can promise you that you will not be disappointed. I am also writing this review before the final 2 episodes, but I cannot wait to see the final 2 episodes!Hope that the producers and writers plan a season 2!!"
46,"What an incredible show. 10 minutes in and I'm rolling my eyes at what I thought was a generic k-dramedy. 30 minutes in though, I was intrigued. By the end of the episode, I was hooked and in love with Attorney Woo. Little did I expect that the following episodes added just further depth, amusement and moments where I literally had tears running down my face. The acting as at times a bit OTT but that just adds to the charm or this show. I'm fascinated to know where the show will go and have my fingers crossed that it continues to deliver so beautifully."
47,"No joking the best show on Netflix this year.A show that makes you laugh and drop tears within the same episode, relaxes your nerve while making you think.Doing 1-2 points well, you get a good show.I can't say too many shows in history did all of those so well.The plot, the cast, the direction, all executed so well."
48,"Extraordinary Attorney Woo is as good as any show that you will see. I have watched the first 8 episodes and I just absolutely loved everything about this wonderful and magical show. It is joyful, heartbreaking, wonderful, magical, and extraordinary. It is impossible not to love Young Woo-Young. Now. I will patiently wait for the next 8 episodes. :)"
49,"This was my first experience with a Korean television show. The production quality was phenomenal, as was the acting and the writing.This show made me laugh and cry, it was quite beautiful.I don't generally enjoy reading subtitles, but it was absolutely worth getting out of my comfort zone for this.Fantastic. I hope they make another season."
