0,1
0.0035959730925624765,"He sounds about as unrealistic and pretentious as you can get with a hipster male lead; but due to the Shin Ha-eun's writing and Kim Seon-ho's modest acting, the end result is actually a subverted take on conventional hetero-masculinity that is rarely seen not just in South Korean shows but frankly everywhere.Labelled as a romantic comedy, I would actually say this is perhaps purely for marketing purposes to stage this show as a light hearted love story between two characters when really, it is a story about the lives of people who live in Gongjin and about overcoming grief."
0.0035947249583783967,"I started few Kdramas on Netflix before this and was struggling to find a decent show.About this show, first of all it is believable, the story I mean."
0.003594382546939533,"I love the morals and life advises they delivered.Kim Seon Ho and Shin Min Ah played the characters very well, with their bickerings as strangers, friends and lovely bickerings, then their lovey dovey acts... Their actings are natural and sincere, masterclass actings.I love the closures of this drama, and how everyone live happily together, with a note that a typhoon may come, but it is okay as long as they are together.I would suggest this drama to everyone I know, for it is a healing drama, especially during this pandemic era."
0.0035927578195730082,So many beautiful people and the filming is wonderfully done.I love the little bit at the end where we learn a little secret about one of the incidents we see in that weeks episode.
0.003589784770423579,"Any show which gets me attached and hooked from early on is straight away deserves 10 stars.Lately at the time of writing there is so much negativity and depressing stuff going on in the world and in our life, i was looking for show which can bring smile on my face after hard day at work."
0.003589708170645205,"The people of Gongjin will surely warm your heart and perhaps make you even wish that you lived in such a community!All in all, this is a fantastic and delightful series!"
0.00358755941174704,"Feel good series.Best Korean series I have ever watched.You will cry smile.Became happy sad
You will be emotional towards the end.I felt like why this series ended within just 16 episodes and why not series goes on forever.I became a part of the town..need to visit that places at least once."
0.0035858119494629366,"The supporting characters do not exist in the story to serve the purpose of bringing the two leads together- in fact a lot of their problems do not relate to the leads at all, however, the realistic and often brutal and ugly at times dialogue that writer Ha-eun writes for each character gives us the sense that this picturesque idyllic town has its own problems just like Hye-jin and their stories are just as important as hers.When you compare Hometown Cha Cha Cha to Mr."
0.0035857098084901753,"I loved the chemistry between the actors, how the story was told, how it was filmed... Every detail was made with love and to make you fall in love with the story and their characters."
0.0035842273768020906,"Very heartwarming, the characters portrayed in such a way that you'd love to come to visit it every now and then."
0.0035825995600971337,You know they are made for each other.This is so far my analysis of the show after watching the first few episodes of it.
0.0035821620790397815,"The chemistry between her and Chief Hong was amazing, and loved how they were the opposite sides that fell in love with each other.My only complain would be the Du-sik drama that was painful to watch (looking at you episode 14&15) because i loved him so."
0.003581625983012549,Short story:- It got me hooked from the very first episode.Long story:- I am someone who have watched plenty of Kdramas in the past and so my standard is pretty high for rating a show as positive.
0.0035805457366328832,"That simplicity is what makes it more HEALING.I somehow relate with the male lead character, because there are really some moments in life where you just want to escape, and find a home that will comfort you."
0.0035754892092667184,"I am not sure how true to life any of this culture is since I have no previous experience watching these type of series, but if even an ounce of it is true that is so wonderful."
0.003574220326978279,"But little that I know, I fell in love with this drama wholly.The story is light and so relatable."
0.0035735785092152546,"Hometown Cha-Cha-Cha reminded me of the precious human connections that we need in order to make life meaningful and enjoyable, coupled with the amazing cinematography and the beauty of their filming location.Each and every actor gave a brilliant performance, from the youngest kid to the oldest grandma."
0.003572662833886386,"This show was refreshing like a wonderful day at the beach, which only made me wanting even more!"
0.0035719052885787553,"The leads have an opposites attract thing going on that is more respectful than antagonistic, which I find refreshing.Often, you will see dramas take a stereotypical moment and put a new spin on it."
0.003570529352156949,It is such a loving look at Gongjin (Pohang) look like such paradise.I've thing I have to discuss is how sooo many of the actors listed as being in this K-Drama are incorrect.
0.0035694916681557384,"And you cannot love others at the expense of yourself either.Of course, as Chief Hong's secret is uncovered, only those who see him for who he is--by his constant example of a man with a good heart--we know that he was not responsible for what happened."
0.0035683019331318767,Shin min a is excellent...the roles r well crafted even for the sides actors..one of the best series I have watched..glued to it since I started watching.
0.0035678087683853033,It was actually an ordinary life that we miss so much in this never ending pandemic T^T and it heartwarming story will touch your soul..
0.0035640030828132255,"In short, he enjoys the simple life of service.Of course, at first, these two opposites do not get on very well."
0.003563782046088188,How is it possible for such a mediocre at best film in the 2000s to be adapted into a mini-series that remains both faithful to its source material yet at the same time creates so much more depth and nuance to its characters and story that in turn makes Mr.
0.0035634051683467068,"I would advise you to ignore the negative reviews here as those people are simply impatient, yes the last few episodes may be have been rushed up a little but still I couldn't stop my tears.This drama really heals you and lets you feel love all over again, brushes up our mind to immerse yourself in living the moment and find ecstasy in everything and everyone around you.You'll learn ll over again how you gotta live your life to it's fullest."
0.003563224850830381,But you will fall in love with it and love every second.
0.0035631771476932876,"Fortunately, she wisely realizes her mistake and tells Chief Hong that he can tell her when he's ready.We get a lot of laugh out loud moments as well as some truly touching ones that are sure to tug at your heart."
0.003562275670628182,"We've seen a lot of opposite atracts shows, series, and films, but not many of them are drawn up quite so wonderfully and heartfelt as this one."
0.0035619424618240627,"It's a nice change!They butthead in the beginning but without her knowledge, he has already attracted & fall in love with her!"
0.0035616145830071086,"It turned out to be one of the cutest Romantic comedies - I just loved how it is so innocent, sweet, lovable with a sense of humor."
0.0035608189994888973,"But this one was just that magical, the interactions between the leads were sweet, never too much and natural, all of these made this series more enjoyable."
0.003560187626421216,I only wish I understood Korean however the English subtitles are well written and make it very easy to understand the humour and the frustration.Praying that there are more seasons and many more episodes.
0.003559800601871668,This caught my attention because of the catchy title and decided to start watching it.
0.00355912313422679,"This drama is a perfect break from EVERYTHING.It makes you go back to what really happens in REALITY, and give you break from all fantasy, suspense and thrilling scenes."
0.00355889009934387,I have seen many Kdramas but this has got to be my new favorite!
0.0035582683087637995,I love it why can't they do 5 a week - so disappointed to have caught up with the live releases.
0.003558194380859181,So fun to see a fresh original show that shines with love and heart.
0.003554923832474096,"Also, I appreciate the way the actress supported Du-sik the whole time.How can I forget about the side characters?"
0.0035546884931551407,The series is much about Yoon learning to appreciate a different lifestyle that is very different from anything she's ever experienced.
0.00355435793911295,"The part where he told the story to Hye-jin was my favorite also.Overall, a must watch, cheerful and sometimes cheesy drama."
0.0035542162593546816,"(Tho Probably not a good idea to streach it because it ended perfectly) The beginning, the character development, and the final."
0.0035541939493372817,"After the first two episodes I wasn't completely sold, but persevered through 16 episodes.I fell in love with all the characters, the longer episodes allows for in-depth character development and I related to an aspect of each and every one of them."
0.0035517668493994826,"Whilst the show's ending can be said by some to be too ideally optimistic, the journey that these characters take to end up where they are is painful, harrowing, hilarious and bittersweet."
0.0035491098115834284,Nobody will smile at me like chief doesSo I have decided to live this love so sweet through this masterpiece.
0.0035471201361933265,And he has no idea just how much he's loved and adored by the people of Gongjin.Both are two sides of the same coin.
0.0035466422352775054,"If you want to know who is in the cast, look up the entry in Wikipedia."
0.003546395629973606,"The whole cast is good and has a role into making it funny, interesting and lovely."
0.003546117599872333,K drama-decent acting all=even the3 old ladies r superb=its funny/sad/etc just hope get the ending well ending i want--and Shin Min-a is not just a grt actress but she is beautiful too.
0.003545853729230849,"I don't think it is predictable, it has original elements well developed and the romance is not the entire focus."
0.0035450709480274213,"I hope Kimseon Ho keeps smiling ,he is captivating, teaching kindness wherever he goes and Shinmin-a has never disappointed me, she is exquisite ,you will know if you have seen ""oh my venus"".I don't want this series to end and I want the writers to keep the humour alive , thanku for goodnight dreams,."
0.0035447357290072446,"And it's proof that you can have good and likeable characters still, in world that seems to want to bombard us with dark ones."
0.003543569072050025,"It deals with the baggage we carry from big or little events, but it always keeps a light touch, or at least returns to a light touch quickly."
0.003543239731357735,Both characters gave positive impacts towards each other.I love the cinematography.I love how the neighbors are fussy but kind...
0.0035428834958269196,This light and breezy drama was just what I was looking for.
0.0035426090088944676,I was slightly disappointed in Dr. Yoon's reaction to him; that she didn't seem to know him nearly as well as those he's lived with in Gongjin.
0.003542231787707007,And I really wish to find my own Gongjin!The actors acting skills is a BIG BONUSSS!
0.0035416858190766526,This series is fun and kept me interested every episode until its done.
0.003541473328055904,It is like daily story that happen to all of us.
0.0035410369324156265,It was heartwarming and the ending was a beautiful conclusion to all the characters stories.
0.003540193055442354,"I didn't think I'd like all of them, but did, especially the there old ladies!"
0.0035395547323391124,I did not expect i will like it and after watching this i became a fan of Seon-ho too.
0.003538449054717388,Kim Seon Ho and Shin Min Ah make a beautiful couple lets hope the story ends happily.All of the other supporting characters have really strong parts and they are great fun to watch.
0.003537685342493392,"By the end of the story, we feel united with, and appreciate even the initially most unlikable members of this tiny community."
0.0035367039047156175,The show is so good and refreshing.
0.0035366338341903045,Just wait until you see who gets the piggyback ride in this one and have it melt your heart.
0.0035360050983385175,I highly recommend it to someone who wants a break from complex dramas/ world.
0.003535030932440818,"The story is not your average good guy/bad guy plot, so I never felt overwhelmed by the scenes."
0.0035345715536770628,"This show makes me want to love and help others, and that's something the world desperately needs."
0.0035338109776228473,I miss watching Min-A on a kdrama and this series did not disappoint.
0.0035332860614238396,Highly recommend you to watch if you enjoy a slow story with character development and brilliant acting.
0.0035328464848725784,"Although it is not all realistic, their natural acting makes this drama so healing and heartwarming."
0.0035326767217860977,It's easy to be there for someone when things are good.
0.0035313989910794705,I would give anything to be able to watch this drama again for the first time.
0.0035304688204127696,I love how all age generations are portrayed in the sea-town - the older generation giving wisdom and I love learning more about the Korean culture.
0.0035302274486619387,"Even when you will have a tear in your eye while watching it, the very next moment you will find yourself laughing!!!"
0.003530184723754054,"This, of course, includes Yoon learning how to be a team player and adapt to the locals as well as the town itself."
0.003528936334179372,"They have a beautiful chemistry together!Not in favour of the leading actress/Hye-Jin in the beginning, she is snobbish & conceited though kind-hearted."
0.0035287540359328754,The leading actor Kim Seon-ho is the perfect person to play this role - you just can't stop watching it.
0.003527780863129902,It's even nice Hye-jin gets along with her step-mom!What a wonderful external family in that town of Gongjin!Perfect ending!
0.0035276645010896843,It's challenging--and even more important--to be there for someone when things are difficult.
0.0035274016964459607,:) Wow Homcha was the only K-drama that hard to move on.
0.0035267956684358064,"Perhaps it's because she's really known nothing else.Upon leaving her job, due to conflict with her boss, Yoon leaves for the small seaside town of Gongjin."
0.0035262506728149425,"This was my third k-drama watch, it was recommended to me from a friend."
0.003526057090677512,"Storyline and most of all the chemistry of the lead characters.So far, I'm only two episodes in and I'm loving this one already."
0.0035259290177127303,"I recommend everyone to watch this masterpiece, because it has it all."
0.003525754342765818,The rural setting makes you wanna retire to some place like this in your future.
0.003525749824864353,"However, the longer she spends in Gongjin, we see her begin to learn how to love and appreciate others."
0.0035254519396032947,"This isn't my first ""healing k-drama"" but definitely is one of my favorites."
0.0035243805290547047,"Honestly, I never thought of that I would like this one, since I was never a big fan of romantics."
0.0035241615977037797,"Having seen a number of K dramas, you begin to notice that there a certain premises that appear frequently."
0.0035237912957303114,"I'm really addicted to this drama.. this drama made me feel something special,happy(sad emotions) ..
why some people gave low ratings🙄100/10."
0.003523372704003306,The last place she felt happy as a child.
0.0035228223033292043,"Old fashioned love story
So real natural and with people next door
A closely knit village community.Great performances by these good looking actors
Awesome cinematography and locations."
0.0035221982320634226,"If you want to just smile, feel good and be happy, go ahead with this drama."
0.003520230518606843,Definitely one of the best if not the best K-drama tv series of all time.
0.0035199018659522467,"The love team is adorable, they are perfect for each other!"
0.003519869691993465,"""Grandma"" Gam-ri all but steals the show and our hearts.As you can imagine, Yoon and Chief Hong soon become attracted to each other."
0.0035196313944831003,Hope they make a sequel or something because I want to see them more.
0.003519208382816806,Perfect whose happy go lucky attitude armed with his plethora of different work licences for his oddball jobs (and accepting only minimum wage) make him the go-to townsperson for everything they need help with.
0.003518153190177005,"I looked at the info and it's only Season 1 , I really hope they renew and have a season 2 or more."
0.003517588424977363,"I love such dramatic stories and I love this series, I like it very much."
0.00351690258532689,It is a worthwhile drive to go visit and linger in Gongjin any time of the year.
0.0035167564005682697,Great script and actors made us want to return night after night for more.
0.003516536114802633,"However, Hong has a dark past that he soon finds is catching up with him."
0.0035163932007290983,"If you want to watch a good and soothing drama, go for it.I usually hate watching love triangles."
0.0035161461945466786,Thank you for reminding me that there is beauty and genuine happiness in SIMPLICITY in these hard times!
0.003515671931457101,"It makes you wanna fall in love, live, have lots of food with friends."
0.003515670808863566,I didn't have any expectations when I first watched this.I thought just to pass the time.
0.0035152330726538846,"The main leads have oozing chemistry, anyone would have fallen for either one (or both) by the end of the drama."
0.003513536426452319,"Yoon (Mina Shin) is a successful dentist who loves living the good life full of fancy clothes, expensive cars, and everything else that goes with high-end living."
0.003512272344191859,"When watching other shows that are thrillers/crime/suspense I have felt anxious and uneasy, that why I really enjoy these romantic stories with a twist."
0.003511732019321797,It perfectly REFLECTS LIFE that there are things that we can expect and things that come to us unexpectedly.
0.003510802299890225,"With the pandemic still going on, I was starting to lose hope."
0.003509887550078622,Keeps you engaged all the time.
0.003509697618146956,Handy look like the adaptation instead?The series begins on a similar trajectory as with the film- Yoon Hye-jin is a dentist in Seoul who quits her high paying dream job to start her own dental practice in Gongjin- a seaside town 3 hours away from the capital with no dental clinic of its own.
0.003508124662187243,"The actress that played her, Lee Bong-Ryun, is listed, but so is someone that was not even in the cast."
0.003508024647307674,"It's so sweet that it saddens my heart to realise that I will never have this kind of love .Nobody will buy me tangerines when I am sick , nobody will eat my porridge even if it's bad , I will have no one to run to if somebody is following me."
0.0035059903068214676,"His past could have been less painful but, even so, they did do it well."
0.003505807714328676,I love love it .. the amazing chemistry between the male and female lead is sooo good .
0.003504210761306983,Indeed the best Rom-Com Kdrama of the yearAnd glad Kim Seon-ho finally had a happy ending!My inner 'Start-Up' rage is now at rest.
0.0035035292284758056,I noticed the main male actor in the leading role Kim Seon-ho in the previous Start-Up series and had to search and find more which led me to Hometown Cha-Cha-Cha.
0.0035030993299442295,And Mina Shin has that million dollar smile and those golden dimples to brighten our days with!Chief Hong is a man who is a complete opposite.
0.0035029552056560363,"Thankfully, Shin Mi-na portrayed each points of Hye-jin with layered nuances that made her relateable on her struggles in adjusting to village life but also at her protestations of the outdated views that still circulate in Gongjin.As the male lead, Hong Du-sik is a character that is seemingly written as Mr."
0.003502216539857199,"The excellent acting, storyline, and setting, capture your interest from beginning to end.Using flashbacks, meaningful events in characters lives are presented, providing understanding for their sometimes annoying and difficult behavior.The storyline knits together several underlying themes, such as the importance of caring for friends, family, and community, despite past disappointments, and troubles, respect for the hard work of every job, doing the right thing whenever the opportunity arises, working together to overcome obstacles, maintaining dedicated relationships with family, friends, coworkers and community, healing heartbreaks and clarifying misunderstandings."
0.0035021608472185265,Watch and replay many times and never get bored about story.
0.0035000928941735492,I miss the old times.Everyone should watch this.
0.00349990696613848,I feel warm and comforted by the story they are telling.
0.0034987435714098902,"She changed because of him, the town & its people!"
0.003497871852832884,"At times, the show will teach you valuable life lessons also."
0.0034978153315635015,"The music is really nice, I just cannot stop listening the soundtracks."
0.003497791251168069,No one has time to check out their neighbours.
0.003496292119528197,"If you need to see something to make you feel good, you're in the right place."
0.003496239443288825,All that matter in this drama is the dialogue and interaction among the characters.
0.003495493033665547,I cried so much towards the end ... just watch it please ...
0.0034954497881682623,"So far, there's been so many heart-warming moments and it's just getting started."
0.0034947441704933006,"Yes, the leads are Yoon Hye-jin and Hong Du-sik, however the leads on average only take up about half the screen time each episode as the rest is divided and devoted to the supporting ensemble cast."
0.0034939682540389124,"If you expect something dramatic, this is not for you."
0.0034935402703711155,This is only the 2nd Korean Netflix Series I have ever seen.
0.0034922238625397354,Very well written and actors have done an amazing job.
0.0034919803656642983,Yoon finds herself stranded in the town on her first day without money or even able to get funds due to a power outage.
0.0034916106398130086,We still don't know the answers to the 3 mysteries!!
0.0034911657826860345,"Love the vibe of this show, from location to cast to their clothing."
0.0034902422707859997,"In short, he doesn't believe himself to be truly worthy."
0.003490173327539528,Even during the sad scenes it makes you feel calm.
0.0034897716370398436,I have seen this show with smile on my face everytime.
0.003489527248187501,"Though the settings and the flow of the story is simple, there are parts that are still unpredictable."
0.003488758617922638,"Her view of success in life revolves around the confines of having an apartment by the Han River, a prestigious education, a high-income paying job and the idea that meritocracy is not a myth."
0.0034887501555313097,"Also, one should never put pressure on someone to reveal that which they are not ready to tell."
0.003488274891041578,I loved it...still watching it and can't stop.
0.0034878006478370614,This story is just so nice.
0.0034874503655213493,"The plot, the scenery, the scripts and the casts of the drama really did well on potraying the drama well."
0.003487042022596347,"Even her found her soul mate who is sweet, kind & a little dense!I-jun the 9 year old is so cute, respectful, sweet & is a Saint!"
0.00348621666634424,"You can only imagine how well Yoon is able to adapt.Without a job and a town without a dentist, Dr. Yoon decides to open up a dental clinic."
0.003485617859707113,"While I've seen this premise many times, each drama was be uniquely different based on the location, characters."
0.0034855659646695655,"But in this drama, they maturely handle the situation."
0.0034848485232850993,This drama story seems simple but give some nice twist on every episode.
0.0034848469113867332,"She's soon at the mercy of Chief Hong, who ends up putting her to work pulling the guts out of squid with the local women."
0.0034841237604674486,"Its less about what story it tells, and more about how its told!"
0.0034839252511394483,The question becomes: will his past destroy things with Dr. Yoon before they've even started?Dr.
0.00348297677455508,The show has the relatable storyline of humble guy meets rich girl and fall in love.
0.0034828603456023917,Those unable to forgive him are simply cowards who decide that it's easier to play the role of the victim rather than take any responsibility.
0.003482406637919239,"Handy (2004)- a film that was riddled with erratic pacing, impassive sound design, underdeveloped characters and sexual assault tropes that absolve men and their crimes, on paper, this TVN adaptation sounds like a recipe for disaster."
0.0034808943400947406,"There, she meets Chief Hong, a man who seems capable of doing literally everything!"
0.003479389027560341,"100% entertainment guarantee worth watching.. story, screen play, choreography, everything perfect and also great actors.. this drama definitely makes you feel happy, music and soundtracks are too good."
0.0034787498037425254,I look forward to spending time with this cast week after week.
0.0034781088407648568,The complexities and contradictions of this character can become easily unlikeable and annoying depending on the pacing and the actress cast.
0.0034740680037513567,"Right now, I am obsessed with this drama."
