0,1
0.0034739108350253676,Time is given for the cinematography to establish Gongjin as a character in itself alongside the cast.
0.003472857284795385,"The girl Bo-ra is also adorable!Felt so sad for the demise of Ms Gam-ri, she is definitely the heart of the town & her 2 bestfriends!"
0.003472551276066815,This drama has the new girl who loses her comfortable life and begins an unfamiliar life in a rural town.
0.0034724483702373537,"It's so nice to see the leading actor/Du-Sik ends up being good friend with Seong-Hyun, who is actually his rival!"
0.003472439566439739,"You are laughing one moment, and crying the next."
0.00347027946397609,I look forward to watching every new episode.
0.0034702725772775,"He thinks mostly of others, even at the expense of himself."
0.0034696619368892257,"We feel an appreciation for small town life, lifelong friendships, and the support the community has for it's members.Three Cheer's to the writers, directors, cameramen and women, editors, and the entire staff."
0.003469013550350152,The setting of a dentist going to open a clinic in a small country city is cliche but works.
0.0034689589890729727,They've absorbed the character so much which makes it natural.
0.003468182885891802,"Humble story, nice story telling but give lots of message in life."
0.003467355062245877,Great job to the whole cast and production team!
0.0034655070987902777,Can't wait how the rest of the story will unfold.
0.003465260773869927,This drama appeared at the exact right time.
0.0034650927146660996,Never get bored with the drama.
0.003464012070456894,Hye-jin was the one he could open up and be his rock.
0.003460136376437524,Much of the success of this series has to go to Mina Shin and Seon-Ho Kim with their incredible chemistry.Dr.
0.003459776764146227,The acoustic guitar riffs between each episode set the tone of a rom-com but it also noticeably shifts to sombre piano notes as the series takes a melancholic shift in the latter part of the show.
0.00345971193251976,This heartwarming story will make you smile and laugh out loud and sometimes bring you to tears.
0.0034582461576069673,I don't know how many times I rewatch it until I remembered the lines.
0.0034577016811143195,The nosy but fun neighbours you grow up on.
0.003457568544181694,"There, her path coincides with an unemployed jack of all trades man Hong Du-sik (also known by everyone in town as Chief Hong) who challenges Hye-jin on her Seoulite attitudes and prejudice against the working class villagers.Yoon Hye-jin is a character that is written in an unusually unapologetic way for a South Korean drama female lead."
0.0034564764039278976,Liked it because somehow feeling peaceful after so long since watched Reply 1988.
0.003455276452845537,"Until that happens, I'll just keep rewatching it."
0.003453733601445218,All of it absolutely perfect.
0.0034523957928923703,"After watching and finishing all episodes of Extraordinary Attorney Woo, I started flipping through Korean tv/movie shows."
0.0034505213953069606,This movie is the movie of the year !!!
0.0034480024434623497,"What seems like a simple narrative actually delves into many facets of human relationships - how strangers become allies, friends, even family."
0.003447941471862704,It's relaxing and doesn't stray away from the story much.
0.0034447065616969156,Her bestfriend is so understanding!
0.003444338299585314,Everything is on point.
0.003443613468189281,"I recognize most of the supporting cast who portray the close knit, supportive and colorful community."
0.003443480263311836,Episodes 13-16 were the best of any series I have watched ever!
0.003443219499688573,I think I will never get over this.
0.0034411563628793905,It draws out emotions from you !
0.0034396246126639127,"Truly, this is my favorite show."
0.0034394446305113903,Loved every bit of this drama.
0.003439428945142636,Like how the romance develops in this drama.
0.003437406905079523,"Handy, the former keeps all the skeletal details of the latter and in addition, fleshes out all the unresolved and underdeveloped tensions in the storyline."
0.00343581272857708,Yoon represents those people who can only think about themselves.
0.0034348385925842004,The whole cast is an extended family and community.
0.003433896749356282,"If you are feeling low or if you are bored, just watch it you won't regret."
0.003433043853665523,Every Character in this show is a Kohinoor in itself.
0.00342582064181273,"You love the town characters, the grannies, the kids, the relationships and the quaint seaside town."
0.0034251919648270518,"She is a judgemental perfectionist with a high moral and ethical compass whilst also being an emotionally compulsive shopaholic, a monthly donator across various charities and a black out drunk."
0.0034242149187803817,It truly aspires me to be better than I am.
0.0034169484245118245,I recommend this in 100%.
0.003416789948272272,The bad guys get caught and get what they deserve.
0.0034158426781141214,My best Korean series for me ....
0.0034134717920754295,A must to view also.
0.003413400386395989,Undoubtedly one of my most cherished Kdramas ever!
0.0034080925773199637,"The content of this drama unique, fresh, classic feel."
0.0034073718849940956,"OST is the LSS-type, scenes are postcard perfect, and the characters are quirky, warm, and genuine."
0.0034042172987181277,"Hometown Cha is an entertaining, charming, feel good story, with a unique plot, interesting characters, and beautiful views of a tiny seaside Korean village."
0.00339976092496628,Good show to watch.
0.00339738576510011,You name it.
0.0033950651806839145,Quite lengthy episodes but definitely worth watching it.
0.0033928230419852067,Both the lead characters are cute looking and instantly lovable.
0.0033925312577440434,Make more dramas like this plz.
0.0033891018677627486,Finally the theme music is a joy..
0.0033869082537328035,She comes off initially as fussy and conceited.
0.00338435135497183,You cannot love others without first loving yourself.
0.0033842747756875117,Everyone else tried to check up on him.
0.0033767895195418083,The romance and chemistry between the two characters are pure and angelic.
0.0033685442901133316,"Had the perfect balance of Romance, Comedy and Melodrama."
0.0033665197046096754,The sea side and views are amazing.
0.003366322528883135,She makes no apologies for her lifestyle.
0.003364751590180224,There are others that are completely incorrect also.
0.0033597384930675227,"There are no ""villains"" but there are secrets, heartaches, even trauma."
0.0033583303784728903,It is the perfect ensemble cast.
0.003357298619141193,The love story is beautiful.
0.0033572170177954166,The storyline is simple and predictable.
0.0033562786121823,The honest and fiery connection with Hye-jin and Du-sik was charming and a joy to watch.
0.0033560642618921453,"For once there is no unnecessary betrayal, evil & despicable people!"
0.003350934494352607,I loved Hye-Jin and her groth to love Gongjin (as did I).
0.0033488548902702426,Everything was perfect !
0.0033487314678995743,What a tv show!
0.0033470933667218788,"Sunday, 17th October 2021Just finished with HOMETOWN CHA-CHA-CHA
.The last 2 episodes were really one heck of an emotional roller-coaster."
0.0033376391679440114,"Drama, romance, plot twist, a good history, good characters and good acting skills."
0.0033268916433234017,"He works a slew of jobs, all for minimum wage."
0.0033260520197025078,"From the youngest Bora to the oldest Miss Gam-RI, I loved everyone."
0.0033174195300774995,Koreans are masters of incorporating both elements into their stories.
0.0033144658765162935,I find it absolutely beautiful!
0.0033139901758574807,Both have to learn how to adapt.
0.0033101825723366755,"So much h emotion, honesty and so timely."
0.003305989784156043,The setting of the town is picturesque and full of colours.
0.0033023736589100085,"There is one role listed twice, the role of Yeo Hwa-Jung."
0.0032982666823101483,I loved it.
0.0032881477529316137,"Loved this Korean drama, a complete rouser."
0.0032856301459554906,"The location , people !"
0.003284926926662261,The characters are not typical Korean drama characters.
0.003281777471359316,Yoon was quite selfish in her demands.
0.0032725672160125487,"Just finished watching another fantastic series, Navillera."
0.003267229709216402,And the chemistry between them ahhhhh omg.
0.003236347377850691,The cinematography is gorgeous in the seaside village of Gongjin.
0.0032356452574971595,A voyage to the countryside of South Korea.
0.0032354912803515368,Waiting for next.
0.00322419720694108,Even watched the 2nd ep twice.
0.0032144602865630516,Jobs well done!
0.003210728116331081,Worth watching!Might binge watch again!
0.0032097961579714927,I laughed and cried a lot.
0.003204055915905596,I loved and adored all sixteen episodes!
0.003196158780607894,Cannot stop watching Korean series/movies.
0.003188161115742038,Maybe a sequel?
0.00318592108932458,"He surfs, cooks, crochets, fixes cars, reads Henry David Thoreau, owns a Leica IIIf, wears flannel shirts and even has a fruit plating license."
0.0031850340231739235,This is a fun thoughtful rom com.
0.0031848328470035427,"Loved the English dubbing, voices and best translation."
0.0031787624640596214,So interesting.
0.0031612766800157258,Please watch it you won't regret!
0.0031581044142835577,"Hye-Jin and Du-sik have unbelievable chemistry and when they smile, huge dimples."
0.0031550751515690045,"Peaceful plot, great ethics, cute love story."
0.0031528875765529573,The scenery is beautiful.
0.0031492657505019688,It's so simple yet so beautifully crafted.
0.0031302155616275314,"Nowadays, everyone is busy."
0.0030563780257818426,Love kim seon ho and shin min ah and other actor and actress supporting this movie.
0.0029893384348243968,She didn't.
0.0029058506598245194,Unlike Hometown Cha Cha Cha's original source material Mr.
0.0028938988309957833,"Heartwarming, relaxing, funny, emotionally fulfilling ,cute.The characters are really lovable."
0.002880557112619557,Great influence!
0.002761105188665181,Its refreshing.
0.0027506943596755234,Hometown Cha Cha Cha is a healing rom-com drama.
0.0022771407794572175,<3.
0.0011531105758496893,BRAVO!
-0.00015681326748770126,Congrats Homcha.
